[
  {
    "id": "autoch-pattern-bolt-pistol",
    "name": "Autoch-pattern bolt pistol",
    "type": "ranged",
    "profiles": [
      {
        "name": "Autoch-pattern bolt pistol",
        "range": 12,
        "stats": {
          "A": 1,
          "S": 4,
          "AP": 0,
          "D": 1,
          "BS": 4
        },
        "keywords": [
          {
            "keyword_id": "pistol"
          }
        ]
      }
    ],
    "game_version": {
      "edition": "11th",
      "dataslate": "mfm-995"
    },
    "external_refs": [
      {
        "namespace": "bsdata",
        "id": "1f41-c120-4d44-a3ae"
      },
      {
        "namespace": "bsdata",
        "id": "31fd-4b29-165b-4d32"
      },
      {
        "namespace": "bsdata",
        "id": "4395-9d32-ee39-52d4"
      },
      {
        "namespace": "bsdata",
        "id": "68ee-3933-b74b-fae0"
      },
      {
        "namespace": "bsdata",
        "id": "72bf-750f-754e-e69b"
      },
      {
        "namespace": "bsdata",
        "id": "7dac-8874-cc2a-0773"
      },
      {
        "namespace": "bsdata",
        "id": "9d35-28a5-cd50-3924"
      },
      {
        "namespace": "bsdata",
        "id": "dd59-d693-8751-7306"
      },
      {
        "namespace": "bsdata",
        "id": "ddf4-b372-1a84-a3a8"
      },
      {
        "namespace": "bsdata",
        "id": "f84f-3597-99d4-a082"
      },
      {
        "namespace": "bsdata",
        "id": "fd3e-2bdd-bba4-ce14"
      },
      {
        "namespace": "mfm",
        "id": "799f27d7-b738-4f9d-a241-d8adcbb9bd72"
      }
    ]
  },
  {
    "id": "close-combat-weapon",
    "name": "Close combat weapon",
    "type": "melee",
    "profiles": [
      {
        "name": "Close combat weapon",
        "range": "Melee",
        "stats": {
          "A": 1,
          "S": 3,
          "AP": 0,
          "D": 1,
          "WS": 4
        },
        "keywords": []
      }
    ],
    "game_version": {
      "edition": "11th",
      "dataslate": "mfm-995"
    },
    "external_refs": [
      {
        "namespace": "bsdata",
        "id": "116e-d7d8-401d-236c"
      },
      {
        "namespace": "bsdata",
        "id": "193f-20f1-988a-5a85"
      },
      {
        "namespace": "bsdata",
        "id": "3b2c-4950-f35b-f75c"
      },
      {
        "namespace": "bsdata",
        "id": "87d6-434d-8e05-b7b8"
      },
      {
        "namespace": "bsdata",
        "id": "facf-684d-ff54-cf3d"
      },
      {
        "namespace": "mfm",
        "id": "cc306b9d-009b-4ea1-bd8b-79028bbb18d2"
      }
    ]
  },
  {
    "id": "etacarn-plasma-gun",
    "name": "EtaCarn plasma gun",
    "type": "ranged",
    "profiles": [
      {
        "name": "EtaCarn plasma gun",
        "range": 24,
        "stats": {
          "A": 1,
          "S": 7,
          "AP": -3,
          "D": 2,
          "BS": 3
        },
        "keywords": [
          {
            "keyword_id": "rapid-fire",
            "parameters": {
              "value": 1
            }
          }
        ]
      }
    ],
    "game_version": {
      "edition": "11th",
      "dataslate": "mfm-995"
    },
    "external_refs": [
      {
        "namespace": "bsdata",
        "id": "58c5-35f8-3823-bf60"
      },
      {
        "namespace": "bsdata",
        "id": "8619-9766-108e-f579"
      },
      {
        "namespace": "mfm",
        "id": "3f8ecf52-adf8-4a11-833c-f81bc90f5383"
      }
    ]
  },
  {
    "id": "exoarmour-grenade-launcher",
    "name": "Exoarmour grenade launcher",
    "type": "ranged",
    "profiles": [
      {
        "name": "Exoarmour grenade launcher",
        "range": 24,
        "stats": {
          "A": "D3",
          "S": 3,
          "AP": 0,
          "D": 1,
          "BS": 3
        },
        "keywords": [
          {
            "keyword_id": "blast"
          }
        ]
      }
    ],
    "game_version": {
      "edition": "11th",
      "dataslate": "mfm-995"
    },
    "external_refs": [
      {
        "namespace": "mfm",
        "id": "8a542174-84c3-4cbc-8b54-26250e8af1dd"
      },
      {
        "namespace": "mfm",
        "id": "e42f3f78-3226-4335-bf1f-4a67f7e3767d"
      }
    ]
  },
  {
    "id": "volkanite-disintegrator",
    "name": "Volkanite disintegrator",
    "type": "ranged",
    "profiles": [
      {
        "name": "Volkanite disintegrator",
        "range": 24,
        "stats": {
          "A": 3,
          "S": 5,
          "AP": 0,
          "D": 1,
          "BS": 3
        },
        "keywords": [
          {
            "keyword_id": "devastating-wounds"
          }
        ]
      }
    ],
    "game_version": {
      "edition": "11th",
      "dataslate": "mfm-995"
    },
    "external_refs": [
      {
        "namespace": "bsdata",
        "id": "0263-c056-d80a-2192"
      },
      {
        "namespace": "bsdata",
        "id": "ee96-471c-ef12-d689"
      },
      {
        "namespace": "mfm",
        "id": "96c8e4aa-6f08-49e6-b140-317a6fb3dae1"
      },
      {
        "namespace": "mfm",
        "id": "e3995386-4b27-4d86-b671-ff162df020f7"
      }
    ]
  },
  {
    "id": "concussion-gauntlet",
    "name": "Concussion gauntlet",
    "type": "melee",
    "profiles": [
      {
        "name": "Concussion gauntlet",
        "range": "Melee",
        "stats": {
          "A": 2,
          "S": 8,
          "AP": -2,
          "D": 2,
          "WS": 3
        },
        "keywords": []
      }
    ],
    "game_version": {
      "edition": "11th",
      "dataslate": "mfm-995"
    },
    "external_refs": [
      {
        "namespace": "bsdata",
        "id": "4af9-1fdc-54b3-617a"
      },
      {
        "namespace": "bsdata",
        "id": "62a4-5af9-8d4d-9d0d"
      },
      {
        "namespace": "mfm",
        "id": "7740adae-d3bc-48fa-958e-077b21c83386"
      }
    ]
  },
  {
    "id": "plasma-blade-gauntlet",
    "name": "Plasma blade gauntlet",
    "type": "melee",
    "profiles": [
      {
        "name": "Plasma blade gauntlet",
        "range": "Melee",
        "stats": {
          "A": 3,
          "S": 6,
          "AP": -2,
          "D": 1,
          "WS": 3
        },
        "keywords": []
      }
    ],
    "game_version": {
      "edition": "11th",
      "dataslate": "mfm-995"
    },
    "external_refs": [
      {
        "namespace": "bsdata",
        "id": "b37a-91d6-b8b2-f879"
      },
      {
        "namespace": "bsdata",
        "id": "e5aa-490d-0302-1725"
      },
      {
        "namespace": "mfm",
        "id": "ca90f9e9-4b6b-49cd-878b-bd4e9c6f07a7"
      },
      {
        "namespace": "mfm",
        "id": "df85fa23-9885-4190-a0ea-90b0db6b7aba"
      }
    ]
  },
  {
    "id": "graviton-hammer",
    "name": "Graviton hammer",
    "type": "melee",
    "profiles": [
      {
        "name": "Graviton hammer",
        "range": "Melee",
        "stats": {
          "A": 3,
          "S": 9,
          "AP": -1,
          "D": 3,
          "WS": 4
        },
        "keywords": [
          {
            "keyword_id": "anti",
            "parameters": {
              "target_keyword": "Monster",
              "threshold": 3
            }
          },
          {
            "keyword_id": "anti",
            "parameters": {
              "target_keyword": "Vehicle",
              "threshold": 3
            }
          }
        ]
      }
    ],
    "game_version": {
      "edition": "11th",
      "dataslate": "mfm-995"
    },
    "external_refs": [
      {
        "namespace": "bsdata",
        "id": "65c7-0826-fdc5-4c70"
      },
      {
        "namespace": "bsdata",
        "id": "a8af-1a28-e453-65d7"
      },
      {
        "namespace": "mfm",
        "id": "3a209889-ed96-4453-952e-0048570a7dfb"
      },
      {
        "namespace": "mfm",
        "id": "fb4a55b2-457a-466b-a2e8-8efdfbf1ddef"
      }
    ]
  },
  {
    "id": "ancestral-wrath",
    "name": "Ancestral Wrath",
    "type": "ranged",
    "profiles": [
      {
        "name": "Witchfire",
        "range": 24,
        "stats": {
          "A": 3,
          "S": 6,
          "AP": -2,
          "D": "D3",
          "BS": 3
        },
        "keywords": [
          {
            "keyword_id": "psychic"
          }
        ]
      },
      {
        "name": "Focused witchfire",
        "range": 24,
        "stats": {
          "A": 6,
          "S": 6,
          "AP": -2,
          "D": "D3",
          "BS": 3
        },
        "keywords": [
          {
            "keyword_id": "hazardous"
          },
          {
            "keyword_id": "psychic"
          }
        ]
      }
    ],
    "game_version": {
      "edition": "11th",
      "dataslate": "mfm-995"
    },
    "external_refs": [
      {
        "namespace": "bsdata",
        "id": "ffcf-690c-5fc4-a7bb"
      },
      {
        "namespace": "mfm",
        "id": "cd215436-901e-452a-a0fb-c93198541202"
      }
    ]
  },
  {
    "id": "autoch-pattern-bolter",
    "name": "Autoch-pattern bolter",
    "type": "ranged",
    "profiles": [
      {
        "name": "Autoch-pattern bolter",
        "range": 24,
        "stats": {
          "A": 2,
          "S": 4,
          "AP": 0,
          "D": 1,
          "BS": 4
        },
        "keywords": []
      }
    ],
    "game_version": {
      "edition": "11th",
      "dataslate": "mfm-995"
    },
    "external_refs": [
      {
        "namespace": "bsdata",
        "id": "77d1-ad07-5fa7-0006"
      },
      {
        "namespace": "bsdata",
        "id": "af62-d6f6-eee1-bde5"
      },
      {
        "namespace": "bsdata",
        "id": "bfa6-9975-6fdc-d5c6"
      },
      {
        "namespace": "mfm",
        "id": "fb5c61bc-363c-4d76-ac29-246031ac9bb9"
      }
    ]
  },
  {
    "id": "ancestral-ward-stave",
    "name": "Ancestral ward stave",
    "type": "melee",
    "profiles": [
      {
        "name": "Ancestral ward stave",
        "range": "Melee",
        "stats": {
          "A": 2,
          "S": 7,
          "AP": -1,
          "D": "D3",
          "WS": 3
        },
        "keywords": [
          {